<?xml version="1.0" encoding="UTF-8"?>
<xs:schema xmlns:xs="http://www.w3.org/2001/XMLSchema"
           targetNamespace="http://www.nure.ua"
           xmlns="http://www.nure.ua"
           elementFormDefault="qualified">
    <xs:element name="bookList">
        <xs:complexType>
            <xs:sequence>

                <xs:element name="book" maxOccurs="unbounded">
                    <xs:complexType>
                        <xs:sequence>
                            <xs:element name="title">
                                <xs:simpleType>
                                    <xs:restriction base="xs:string">
                                        <xs:pattern value=".+"/>
                                    </xs:restriction>
                                </xs:simpleType>
                            </xs:element>
                        </xs:sequence>
                    </xs:complexType>
                </xs:element>

            </xs:sequence>
        </xs:complexType>
    </xs:element>
</xs:schema>
